[
  {
    "term": "Action",
    "aliases": ["ROS Action", "Action Server"],
    "definition": "A ROS 2 communication pattern for long-running tasks that provides feedback during execution and allows cancellation. Actions combine request-response (like services) with ongoing feedback updates.",
    "relatedChapters": ["Module 1: Actions", "Multi-Node Systems"],
    "externalLinks": [
      { "label": "ROS 2 Actions Documentation", "url": "https://docs.ros.org/en/humble/Tutorials/Intermediate/Writing-an-Action-Server-Client/Py.html" }
    ]
  },
  {
    "term": "Actuator",
    "aliases": ["Motor", "Servo"],
    "definition": "A mechanical device that converts electrical signals into physical motion. Common types include DC motors, servo motors, and stepper motors used to control robot joints and movements.",
    "relatedChapters": ["Module 2: Robot Modeling"],
    "externalLinks": [
      { "label": "Actuator Types Overview", "url": "https://en.wikipedia.org/wiki/Actuator" }
    ]
  },
  {
    "term": "Adaptive Monte Carlo Localization",
    "aliases": ["AMCL", "MCL"],
    "definition": "A probabilistic localization algorithm that uses particle filters to estimate a robot's position within a known map. It adapts the number of particles based on localization confidence.",
    "relatedChapters": ["Module 2: Navigation"],
    "externalLinks": [
      { "label": "AMCL ROS Package", "url": "https://navigation.ros.org/configuration/packages/configuring-amcl.html" }
    ]
  },
  {
    "term": "AGI",
    "aliases": ["Artificial General Intelligence"],
    "definition": "A hypothetical form of artificial intelligence that possesses the ability to understand, learn, and apply knowledge across a wide range of tasks at a human-like level.",
    "relatedChapters": ["Module 4: VLA Models"],
    "externalLinks": []
  },
  {
    "term": "Bag File",
    "aliases": ["ROSbag", "ROS Bag"],
    "definition": "A file format used in ROS to record and playback topic data. Useful for debugging, testing, and creating reproducible scenarios without re-running live systems.",
    "relatedChapters": ["Module 1: ROS 2 Fundamentals"],
    "externalLinks": [
      { "label": "ROS 2 Bag Documentation", "url": "https://docs.ros.org/en/humble/Tutorials/Beginner-CLI-Tools/Recording-And-Playing-Back-Data/Recording-And-Playing-Back-Data.html" }
    ]
  },
  {
    "term": "Base Link",
    "aliases": ["base_link", "Robot Base"],
    "definition": "The primary coordinate frame attached to the robot's base, serving as the reference point for all other frames in the robot's transformation tree (TF tree).",
    "relatedChapters": ["Module 1: ROS 2 Fundamentals", "Module 2: URDF Modeling"],
    "externalLinks": []
  },
  {
    "term": "BERT",
    "aliases": ["Bidirectional Encoder Representations from Transformers"],
    "definition": "A transformer-based language model developed by Google that uses bidirectional training to understand context from both left and right of a word in sentences.",
    "relatedChapters": ["Module 4: VLA Models"],
    "externalLinks": [
      { "label": "BERT Paper", "url": "https://arxiv.org/abs/1810.04805" }
    ]
  },
  {
    "term": "Camera Intrinsics",
    "aliases": ["Calibration Matrix", "K Matrix"],
    "definition": "Parameters describing a camera's internal characteristics including focal length, optical center, and lens distortion. Essential for 3D reconstruction and computer vision tasks.",
    "relatedChapters": ["Module 3: Perception Pipeline"],
    "externalLinks": []
  },
  {
    "term": "Capstone Project",
    "aliases": ["Final Project"],
    "definition": "The culminating project integrating all four course modules (ROS 2, Digital Twin, Isaac Sim, VLA) into a complete autonomous humanoid system capable of natural language control.",
    "relatedChapters": ["Week 13: Capstone Integration"],
    "externalLinks": []
  },
  {
    "term": "Cartesian Space",
    "aliases": ["Task Space", "Operational Space"],
    "definition": "The 3D workspace defined by X, Y, Z coordinates and orientation (roll, pitch, yaw) where the robot end-effector operates, as opposed to joint space.",
    "relatedChapters": ["Module 2: Manipulation"],
    "externalLinks": []
  },
  {
    "term": "CLIP",
    "aliases": ["Contrastive Language-Image Pretraining"],
    "definition": "An OpenAI model that learns visual concepts from natural language supervision, enabling zero-shot image classification and vision-language understanding.",
    "relatedChapters": ["Module 4: VLA Models"],
    "externalLinks": [
      { "label": "CLIP Paper", "url": "https://arxiv.org/abs/2103.00020" }
    ]
  },
  {
    "term": "Colcon",
    "aliases": ["Colcon Build System"],
    "definition": "The build system used in ROS 2 for compiling packages. It supports multiple build types (CMake, Python setuptools, ament) and parallel builds for faster compilation.",
    "relatedChapters": ["Module 1: ROS 2 Fundamentals"],
    "externalLinks": [
      { "label": "Colcon Tutorial", "url": "https://docs.ros.org/en/humble/Tutorials/Beginner-Client-Libraries/Colcon-Tutorial.html" }
    ]
  },
  {
    "term": "Collision Detection",
    "aliases": ["Collision Checking"],
    "definition": "The process of determining whether objects in a simulated or real environment intersect or come into contact. Critical for motion planning and safety.",
    "relatedChapters": ["Module 2: Gazebo Simulation", "Module 3: Isaac Sim"],
    "externalLinks": []
  },
  {
    "term": "Costmap",
    "aliases": ["Occupancy Grid", "Navigation Costmap"],
    "definition": "A 2D grid representation of the environment where each cell has a cost value indicating traversability. Used by navigation algorithms to plan collision-free paths.",
    "relatedChapters": ["Module 2: Navigation"],
    "externalLinks": []
  },
  {
    "term": "CUDA",
    "aliases": ["Compute Unified Device Architecture"],
    "definition": "NVIDIA's parallel computing platform and API that allows developers to use GPUs for general-purpose processing, essential for deep learning and physics simulation.",
    "relatedChapters": ["Setup: Hardware Requirements", "Module 3: Isaac Sim"],
    "externalLinks": [
      { "label": "CUDA Toolkit", "url": "https://developer.nvidia.com/cuda-toolkit" }
    ]
  },
  {
    "term": "DDS",
    "aliases": ["Data Distribution Service", "RTPS"],
    "definition": "The middleware protocol used by ROS 2 for inter-process communication. Provides real-time publish-subscribe messaging with quality-of-service guarantees.",
    "relatedChapters": ["Module 1: ROS 2 Architecture"],
    "externalLinks": [
      { "label": "DDS Specification", "url": "https://www.omg.org/spec/DDS/" }
    ]
  },
  {
    "term": "Degrees of Freedom",
    "aliases": ["DOF"],
    "definition": "The number of independent parameters that define a robot's configuration. A 6-DOF manipulator can position and orient its end-effector freely in 3D space.",
    "relatedChapters": ["Module 2: Kinematics"],
    "externalLinks": []
  },
  {
    "term": "Digital Twin",
    "aliases": ["Virtual Twin", "Simulation Model"],
    "definition": "A virtual replica of a physical system that mimics its behavior, appearance, and dynamics. Used for testing, training, and validation before deploying to real hardware.",
    "relatedChapters": ["Module 2: Digital Twin Simulation"],
    "externalLinks": []
  },
  {
    "term": "Direct Kinematics",
    "aliases": ["Forward Kinematics", "FK"],
    "definition": "The process of calculating the end-effector position and orientation given joint angles. The opposite of inverse kinematics.",
    "relatedChapters": ["Module 2: Kinematics"],
    "externalLinks": []
  },
  {
    "term": "Domain Randomization",
    "aliases": ["Sim-to-Real Transfer"],
    "definition": "A technique for training models in simulation with randomized parameters (lighting, textures, physics) to improve transferability to real-world environments.",
    "relatedChapters": ["Module 2: Unity ML-Agents"],
    "externalLinks": []
  },
  {
    "term": "Embodied AI",
    "aliases": ["Physical AI", "Embodied Intelligence"],
    "definition": "AI systems that interact with the physical world through sensors and actuators, as opposed to purely virtual AI. Includes robots, autonomous vehicles, and smart devices.",
    "relatedChapters": ["Introduction"],
    "externalLinks": []
  },
  {
    "term": "End Effector",
    "aliases": ["Gripper", "Tool"],
    "definition": "The device at the end of a robotic arm that interacts with the environment, such as a gripper, suction cup, or welding torch.",
    "relatedChapters": ["Module 2: Manipulation"],
    "externalLinks": []
  },
  {
    "term": "Extended Kalman Filter",
    "aliases": ["EKF"],
    "definition": "A nonlinear version of the Kalman filter used for state estimation by linearizing around the current estimate. Commonly used for sensor fusion and robot localization.",
    "relatedChapters": ["Module 3: Sensor Fusion"],
    "externalLinks": []
  },
  {
    "term": "Fuse.js",
    "aliases": ["Fuzzy Search"],
    "definition": "A JavaScript library for lightweight fuzzy-search functionality, used in this textbook for the glossary search component with approximate string matching.",
    "relatedChapters": ["Setup: Glossary Search"],
    "externalLinks": [
      { "label": "Fuse.js Documentation", "url": "https://fusejs.io/" }
    ]
  },
  {
    "term": "Gazebo",
    "aliases": ["Gazebo Simulator", "Ignition Gazebo"],
    "definition": "An open-source 3D robot simulator that provides physics simulation, sensor models, and integration with ROS. Used for testing algorithms before hardware deployment.",
    "relatedChapters": ["Module 2: Digital Twin Simulation"],
    "externalLinks": [
      { "label": "Gazebo Website", "url": "https://gazebosim.org/" }
    ]
  },
  {
    "term": "Grasp Planning",
    "aliases": ["Grasping", "Grasp Synthesis"],